{
  "$schema": "http://json-schema.org/draft-07/schema#",
  "type": "object",
  "properties": {
    "$schema": {
      "type": "string",
      "format": "string"
    },
    "id": {
      "type": "string",
      "format": "string"
    },
    "name": {
      "type": "string",
      "format": "string"
    },
    "glob": {
      "type": "string",
      "format": "string"
    },
    "description": {
      "type": "string",
      "format": "string"
    },
    "author": {
      "type": "string",
      "format": "string"
    },
    "variables": {
      "type": "object"
    }
  },
  "required": [
    "id",
    "name",
    "glob",
    "variables"
  ],
  "additionalProperties": false
}
